{"kind":"CI_CONNECTION_REGISTRY_RUNTIME","version":"1.1.0","id":"CI.REGISTRY","root":"CI.LINK","policy":{"order":["direct_callable","CI.LINK","safe_fallback","blocker"],"live_status_only":true,"writes_need_evidence":true,"elevated_needs_gate":true,"no_secrets":true,"delegation":{"execution_plane":"external_nodes","client_role":"thin_surface","known_route_no_search":true,"auto_requires_registered_operation":true,"auto_requires_live_state":true,"evidence_required":true,"gated_operations_keep_bound_executor":true,"client_local_allowed":["input_capture","render_result","ephemeral_cache","connectivity","secure_auth_handoff","device_presence"]},"freshness":{"acceptance_max_age_seconds":86400,"stale_route_behavior":"keep_bound_executor","stale_action":"verify_bound_node","no_search_on_stale":true,"evidence_must_be_revalidated_before_current_claim":true},"personal_resource_trust":{"enabled":true,"ownership_is_explicit":true,"connector_presence_is_not_ownership":true,"evidence_required":true,"provenance_required":true,"independent_verification_for_writes":true,"classifications":["OWNED_VERIFIED","DELEGATED_VERIFIED","AVAILABLE_UNVERIFIED","STALE","BLOCKED"],"routing_preference":["OWNED_VERIFIED","DELEGATED_VERIFIED","VERIFIED_EXTERNAL_EXECUTOR"],"secret_material_is_not_evidence":true,"audit_fields":["ci_id","route","authority","verification_status","evidence","last_verified","allowed_ops","blocker"]}},"index":{"ci_core":["CI.LINK","CI.CORE"],"code_repo":["CI.GITHUB"],"database":["CI.SUPABASE"],"deploy_hosting":["CI.VERCEL","CI.CLOUDFLARE"],"home_local":["CI.RDC","CI.ORANGE","CI.KEENETIC","CI.HOME","CI.VAULT"],"files_docs":["CI.DRIVE","CI.DROPBOX","CI.SHAREPOINT","CI.NOTION","CI.VAULT"],"communication":["CI.GMAIL","CI.TEAMS"],"calendar_contacts":["CI.CALENDAR","CI.CONTACTS"],"crm_ops":["CI.HUBSPOT","CI.AIRTABLE"],"design":["CI.FIGMA","CI.CANVA"],"openai":["CI.OPENAI"],"web_sources":["CI.WEB"],"local_files":["CI.FILES"],"compute":["CI.PYTHON"],"image":["CI.IMAGE"],"automation":["CI.AUTOMATION"]},"routes":{"CI.LINK":{"via":["http_action_or_connector:CI.LINK"],"risk":"scoped","live":"verify_live","passport":"ci-link-passport.json","ops":["status","contact","sync","read_context"],"auto_ops":["status","read_context"]},"CI.CORE":{"via":["CI.LINK"],"risk":"scoped","live":"verify_via_root","ops":["classify","route","policy","verification"],"auto_ops":["classify","route","policy","verification"]},"CI.GITHUB":{"via":["connector:GitHub","CI.LINK"],"risk":"write_gated","live":"runtime","fallback":["CI.WEB"],"ops":["read_repo","issues","pull_requests","commits","repo_write_when_authorized"],"auto_ops":["read_repo","issues","pull_requests","commits"]},"CI.SUPABASE":{"via":["connector:Supabase","CI.LINK"],"risk":"write_gated","live":"runtime","ops":["query","migrations","edge_functions","project_state"],"auto_ops":["query","project_state"]},"CI.VERCEL":{"via":["connector:Vercel","CI.LINK"],"risk":"elevated_write","live":"runtime","ops":["projects","deployments","logs","deploy"],"auto_ops":["projects","deployments","logs"]},"CI.CLOUDFLARE":{"via":["runtime_connector:Cloudflare","CI.LINK"],"risk":"elevated_write","live":"runtime","ops":["worker_status","deploy_when_executor_available","tunnel_context"],"auto_ops":["worker_status","tunnel_context"]},"CI.RDC":{"via":["connector:Remote_Desktop_Commander","CI.LINK"],"risk":"elevated_write","live":"runtime","ops":["filesystem","terminal","processes","remote_execution"]},"CI.ORANGE":{"via":["CI.RDC","CI.LINK"],"risk":"device_write","live":"runtime","ops":["status","services","logs","execution_when_executor_available"],"auto_ops":["status","services","logs"]},"CI.KEENETIC":{"via":["CI.LINK","CI.RDC"],"risk":"device_write","live":"runtime","ops":["status","network_context","configuration_when_authorized"],"auto_ops":["status","network_context"]},"CI.HOME":{"via":["CI.LINK","CI.RDC"],"risk":"contextual","live":"runtime","ops":["context","routing","device_and_resource_coordination"],"auto_ops":["context","routing"]},"CI.DRIVE":{"via":["connector:Google_Drive","CI.LINK"],"risk":"write_gated","live":"runtime","fallback":["CI.FILES"],"ops":["search","read","write_when_authorized"],"auto_ops":["search","read"]},"CI.DROPBOX":{"via":["connector:Dropbox","CI.LINK"],"risk":"write_gated","live":"runtime","ops":["search","read","write_when_authorized"],"auto_ops":["search","read"]},"CI.SHAREPOINT":{"via":["connector:Microsoft_SharePoint","CI.LINK"],"risk":"write_gated","live":"runtime","ops":["search","read","write_when_authorized"],"auto_ops":["search","read"]},"CI.NOTION":{"via":["connector:Notion","CI.LINK"],"risk":"write_gated","live":"runtime","ops":["search","read","write_when_authorized"],"auto_ops":["search","read"]},"CI.GMAIL":{"via":["connector:Gmail","CI.LINK"],"risk":"external_write","live":"runtime","ops":["search","read","draft","send_when_authorized"],"auto_ops":["search","read"]},"CI.TEAMS":{"via":["connector:Microsoft_Teams","CI.LINK"],"risk":"external_write","live":"runtime","ops":["search","read","send_when_authorized"],"auto_ops":["search","read"]},"CI.CALENDAR":{"via":["connector:Google_Calendar","CI.LINK"],"risk":"external_write","live":"runtime","ops":["search_events","availability","create_update_delete_when_authorized"],"auto_ops":["search_events","availability"]},"CI.CONTACTS":{"via":["connector:Google_Contacts","CI.LINK"],"risk":"sensitive_read","live":"runtime","ops":["find","read"],"auto_ops":["find","read"]},"CI.HUBSPOT":{"via":["connector:HubSpot","CI.LINK"],"risk":"write_gated","live":"runtime","ops":["read","analyze","create_update_when_authorized"],"auto_ops":["read","analyze"]},"CI.AIRTABLE":{"via":["connector:Airtable","CI.LINK"],"risk":"write_gated","live":"runtime","ops":["read","analyze","create_update_when_authorized"],"auto_ops":["read","analyze"]},"CI.FIGMA":{"via":["connector:Figma","CI.LINK"],"risk":"write_gated","live":"runtime","ops":["read_design_context","create_update_when_authorized"],"auto_ops":["read_design_context"]},"CI.CANVA":{"via":["connector:Canva","CI.LINK"],"risk":"write_gated","live":"runtime","ops":["design_assets","create_update_when_authorized"]},"CI.OPENAI":{"via":["connector:OpenAI_Platform","CI.WEB","CI.LINK"],"risk":"credential_sensitive","live":"runtime","ops":["platform_context","api_key_workflows_when_authorized"],"auto_ops":["platform_context"]},"CI.WEB":{"via":["native:web"],"risk":"read_only","live":"runtime","ops":["search","read","current_verification"],"auto_ops":["search","read","current_verification"]},"CI.FILES":{"via":["native:file_search"],"risk":"read_only","live":"runtime","ops":["search","read"],"auto_ops":["search","read"]},"CI.PYTHON":{"via":["native:python"],"risk":"local_only","live":"runtime","ops":["compute","analysis","file_generation"],"auto_ops":["compute","analysis","file_generation"]},"CI.IMAGE":{"via":["native:image_generation"],"risk":"content_generation","live":"runtime","ops":["generate","edit"],"auto_ops":["generate","edit"]},"CI.AUTOMATION":{"via":["native:automation"],"risk":"future_action","live":"runtime","fallback":["CI.LINK"],"ops":["schedule","recurrence","condition_watch"]},"CI.VAULT":{"via":["CI.ORANGE","CI.RDC"],"risk":"scoped_storage_write","live":"runtime","ops":["status","list","stat","download","upload","mkdir","move","rename","delete"],"auto_ops":["status","list","stat","download","upload","mkdir","move","rename"]}}}